source_id,prong,topic_cluster,source_title_or_owner,url,format,source_category,source_level,holistika_reliability_score,external_perceived_credibility_score,control_confidence_level,decision_use,notes
SRC-MS-01,MS,cursor_model_benchmarks,Artificial Analysis Coding Agent Index,https://artificialanalysis.ai/articles/cursor-composer-2-5-coding-agent-index,report,OSINT,3.2,4,5,Safe,Cursor model switch recommendation,"Independent benchmark org; Composer 2.5 scores 62 (3rd) vs Opus 4.7 max 66 + GPT-5.5 65 at 10-60x lower cost; coding-only eval so does not measure interpretive work."
SRC-MS-02,MS,cursor_model_benchmarks,TechTimes critical review of Composer 2.5,http://www.techtimes.com/articles/316917/20260520/cursor-composer-25-matches-claude-opus-47-coding-benchmarks-one-tenth-cost.htm,article,OSINT,1.3,4,4,Safe,Cursor model switch recommendation,"Balanced counter-view; flags vendor-produced scores + Beijing-built open base model (Kimi K2.5) + no system card; the skeptic signal in the set."
SRC-MS-03,MS,cursor_model_benchmarks,DataCamp Composer 2.5 benchmarks and pricing,https://www.datacamp.com/blog/composer-2-5,report,OSINT,2.1,3,4,Safe,Cursor model switch recommendation,"Clean benchmark table; explicit per-task routing guidance Composer for everyday coding + Opus for careful reasoning and 1M context."
SRC-MS-04,MS,cursor_model_benchmarks,BuildFastWithAI Composer 2.5 full review,https://www.buildfastwithai.com/blogs/cursor-composer-2-5-review-2026,article,OSINT,2.1,3,2,Safe,Cursor model switch recommendation,"Vendor-friendly review; useful on the default-effort CursorBench number where Composer edges Opus; treat enthusiasm with caution."
SRC-MS-05,MS,cursor_model_benchmarks,Handy AI Model Drop Composer 2.5,https://handyai.substack.com/p/model-drop-composer-25,article,OSINT,2.1,3,2,Safe,Cursor model switch recommendation,"Independent analyst; names the Pareto-frontier framing (cost-per-task curve not headline score) + single-vendor-wall + open-weights-base caveats."
SRC-MS-06,MS,model_routing,Digital Applied Composer 2.5 vs Claude Code routing guide,https://www.digitalapplied.com/blog/composer-2-5-vs-claude-code-routing-guide,article,OSINT,2.1,3,3,Safe,Cursor model routing recommendation,"Route-by-task thesis; Composer for high-volume scaffolding + Opus elsewhere; flags Cursor-IDE lock-in as the real decision not benchmark quality."
SRC-MS-07,MS,opus_vs_codex,Trensee Opus 4.7 vs GPT-5.5 Codex 7 scenarios,https://www.trensee.com/en/blog/comparison-claude-opus-4-7-vs-gpt-5-5-codex-2026-04-28,article,OSINT,2.1,3,2,Safe,Codex fitness for interpretive work,"Bug-fix + code-review + architectural reasoning tilt Opus; terminal + long-context tilt Codex; supports keeping Codex off the interpretation lane."
SRC-MS-08,MS,model_routing,Lushbinary Composer vs Opus vs GPT-5.5 comparison,https://lushbinary.com/blog/composer-2-5-vs-claude-opus-4-7-vs-gpt-5-5-coding-comparison/,article,OSINT,2.1,3,2,Safe,Cursor model routing recommendation,"Task-to-model matrix; sensitive single-shot reliability + architectural review pick Opus; multi-file refactor picks Composer; multimodal picks GPT-5.5."
SRC-MS-09,MS,cursor_model_benchmarks,OfficeChai Composer 2.5 index coverage,https://officechai.com/ai/cursors-composer-2-5-places-3rd-in-artificial-analysis-coding-agent-index-is-10-60x-cheaper-than-variants-above-it/,article,OSINT,1.3,3,3,Safe,Cursor model switch recommendation,"Journalism restating the Artificial Analysis index; corroborates cost-per-task spread 0.07-0.44 Composer vs ~4 dollars frontier."
SRC-MS-10,MS,opus_vs_codex,Medium unicodeveloper Claude Code vs Codex vs OpenCode 2026,https://medium.com/@unicodeveloper/claude-code-vs-codex-vs-opencode-which-ai-coding-agent-is-actually-the-best-in-2026-baa9f6fd5374,article,OSINT,2.1,2,2,Safe,Open-source routing forward-pointer,"Opinion piece; surfaces OpenCode BYOK + open-source routing as a cheaper lane; low reliability but useful pointer for OSS prong."
SRC-MS-11,MS-OSS,open_source_llm_landscape,Lushbinary Best Open-Source LLMs for AI Agents May 2026,https://lushbinary.com/blog/best-open-source-llms-ai-agents-may-2026-comparison/,article,OSINT,2.1,3,3,Safe,Open-source LLM routing for AKOS/RunPod,"Compares DeepSeek V4 Flash/Pro + Kimi K2.6 + Qwen 3.6 + GLM 5.1 on cost + license + tool-calling + self-host footprint; vendor-adjacent but structured."
SRC-MS-12,MS-OSS,open_source_llm_landscape,MindStudio Best Open-Source LLMs for Agentic Coding 2026,https://www.mindstudio.ai/blog/best-open-source-llms-agentic-coding-2026/,article,OSINT,2.1,3,3,Safe,Open-source LLM routing for MADEIRA/agents,"Deployment-oriented; names MoE cost advantage + recoverable failure modes + when open-weight beats closed API for agent pipelines."
SRC-MS-13,MS-OSS,open_source_llm_landscape,Hugging Face Best Open-Source LLM Models 2026,https://huggingface.co/blog/daya-shankar/open-source-llms,article,OSINT,3.2,4,4,Safe,Open-source LLM routing matrix,"Community hub primary source; separates coding vs local vs agentic picks; flags Kimi/GLM as API-heavy vs Gemma/Phi for local."
SRC-MS-14,MS-OSS,open_source_llm_landscape,Codersera Kimi K2.6 vs DeepSeek V4 vs GLM-5.1,https://codersera.com/blog/kimi-k2-6-vs-deepseek-v4-vs-glm-5-1-2026/,article,OSINT,2.1,3,3,Safe,Open-source LLM license + cost routing,"License comparison (MIT vs Modified MIT); dual-model pattern cheap Flash + strong Pro/Kimi for hard tasks."
SRC-MS-15,MS-OSS,open_source_llm_landscape,DeepSeek vs Kimi 2026 developer comparison,https://deepseekai.guide/comparisons/deepseek-vs-kimi/,article,OSINT,2.1,3,3,Safe,Open-source API vs self-host routing,"DeepSeek wins price + 1M context; Kimi wins agent swarms + multimodal coding; supports tiered routing not single OSS pick."
SRC-MS-16,MS-OSS,benchmark_skepticism,AgentMarketCap SWE-bench vs Reality 2026,https://agentmarketcap.ai/blog/2026/04/08/real-world-coding-agent-performance-vs-swe-bench-2026,article,OSINT,2.1,4,3,Safe,Do-not-procure-on-Verified-alone,"Skeptic anchor; solution leakage inflates Verified scores; Pro/harder evals collapse to ~23%; procurement risk framing."
SRC-MS-17,MS-OSS,benchmark_skepticism,Particula SWE-Bench Pro multi-file collapse,https://particula.tech/blog/swe-bench-pro-multi-file-coding-collapse,article,OSINT,2.1,4,4,Safe,Weight Pro over Verified for agent selection,"Harness variance > model variance on Pro; weight Pro 3-5x over Verified for production refactor picks."
SRC-MS-18,MS-MM,image_generation,DEV Community open-source image gen laptop benchmark 2026,https://dev.to/lucylll/i-benchmarked-5-open-source-ai-image-generators-on-my-laptop-heres-what-actually-works-in-2026-35m4,article,OSINT,2.1,4,3,Safe,Image model pick by VRAM tier,"Hands-on VRAM table: SD3.5 12GB + FLUX dev 16GB + Hunyuan 24GB+; speed vs quality tradeoffs on consumer hardware."
SRC-MS-19,MS-MM,image_generation,Pixazo Top Open-Source Image Generation Models 2026,https://www.pixazo.ai/blog/top-open-source-image-generation-models,article,OSINT,2.1,3,3,Safe,Image model licensing + use-case matrix,"Head-to-head table FLUX.2 + Qwen-Image + Hunyuan + SD; license caveats on FLUX commercial terms."
SRC-MS-20,MS-MM,image_generation,Will It Run AI Stable Diffusion vs Flux 2026,https://willitrunai.com/blog/stable-diffusion-vs-flux-2026,article,OSINT,2.1,4,3,Safe,Image model hardware routing,"VRAM ladder SD1.5 4GB through Flux 12GB GGUF; ecosystem vs quality fork (SDXL LoRA vs Flux photorealism)."
SRC-MS-21,MS-MM,multimodal_video_3d,NVIDIA RTX AI Garage ComfyUI Wan Qwen Flux Hunyuan3D,https://blogs.nvidia.com/blog/rtx-ai-garage-comfyui-wan-qwen-flux-krea-remix/,article,OSINT,3.2,4,5,Safe,Video + 3D production stack wiring,"Vendor-neutral workflow pattern: ComfyUI orchestrates Wan 2.2 video + Qwen-Image + FLUX Krea + Hunyuan3D 2.1; RTX-local inference posture."
SRC-MS-22,MS-MM,multimodal_video_3d,WaveSpeed best open-source image models 2026 landing,https://wavespeed.ai/landing/models/best-open-source-image-models-2026,article,OSINT,2.1,2,2,Euclid,Image API vs self-host,"Commercial inference platform marketing page; useful model-ID enumeration but treat performance claims as vendor pitch."
SRC-MS-23,MS-OSS,holistika_internal_substrate,I84 substrate audit Q2 2026 (CORPINT),docs/wip/intelligence/substrate-audit-2026-Q2/2026-Q2-substrate-audit.md,internal_canonical,CORPINT,4.1,5,2,Safe,FK wiring to SUBSTRATE_REGISTRY,"Already in-production: OpenClaw + Ollama + RunPod vLLM + Groq; pilot: Vercel AI SDK + CrewAI; forecasted agent SDKs."
SRC-MS-24,MS-OSS,holistika_internal_substrate,AKOS model catalog + tier registry (CORPINT),docs/ARCHITECTURE.md,internal_canonical,CORPINT,4.1,5,1,Safe,Self-host model inventory SSOT,"Documents config/model-catalog.json + config/model-tiers.json; RunPod/vLLM entries (DeepSeek R1/V3 + Llama)."
SRC-MS-25,MS-OSS,benchmark_skepticism,VentureBeat DeepSWE benchmark critique,https://venturebeat.com/technology/deepswe-blows-up-the-ai-coding-leaderboard-crowns-gpt-5-5-and-finds-claude-opus-exploiting-a-benchmark-loophole,article,OSINT,1.3,3,4,Safe,Benchmark leaderboard skepticism,"Startup-published alternative benchmark; useful as anti-hype signal but conflicts with Scale AI SWE-Bench Pro vendor interests."
