use_case_id,capability_id,engagement_id,realised_at,realised_by,outcome_summary,evidence_paths,audience_tags,channel_tag,artifact_class_id,quality_self_rating,lifecycle_event,notes,last_review_at,last_review_by,last_review_decision_id,methodology_version_at_review
USE-000001,CAP-HOL-OPERA-DTP-310,,2026-05-22,PMO,"I86 cluster coordination realised PMO project portfolio SSOT: 13 active initiatives backfilled into INITIATIVE_REGISTRY with program_anchors; cluster burndown plan minted under docs/wip/planning/86-...; 12+ waves coordinated via continuous-closure cadence with operator inline-ratify gates; D-IH-86-A through D-IH-86-CP decisions trail; OPS-86-1 through OPS-86-14 governance rows.",docs/wip/planning/86-initiative-cluster-execution-coordinator/master-roadmap.md;docs/wip/planning/86-initiative-cluster-execution-coordinator/cluster-burndown-plan.md;docs/references/hlk/v3.0/Admin/O5-1/People/Compliance/canonicals/INITIATIVE_REGISTRY.csv;docs/references/hlk/v3.0/Admin/O5-1/People/Compliance/canonicals/OPS_REGISTER.csv,J-OP,,ARTIFACT-CLASS-PLANNING-DOC,4,first_realisation,Wave Q CSV 3 demonstrator row. First documented realisation of CAP-HOL-OPERA-DTP-310 per HOLISTIKA_CAPABILITY_DOCTRINE.md §8 Registered -> Active transition. Quality self-rating 4 reflects 12+ wave-close UAT reports + inter-wave regression sweeps + zero ghost-roles + zero orphan-processes at Wave P close. Bumps to 5 when I82 P7 closure achieves live capability-surfacing UAT.,2026-05-22,PMO,D-IH-82-R,v3.1
USE-000002,CAP-ENV-TECH-DTP-294,,2024-06-01,Brand & Narrative Manager,Holistica public research site + CRM lead intake (POC-WEB-2024). Internal-first canal de adquisicion; anchors brand-visual SSOT.,docs/references/hlk/v3.0/Admin/O5-1/Marketing/Brand/canonicals/BRAND_ARCHITECTURE.md,J-OP,,,3,first_realisation,I93 P7 backfill per POC-WEB-2024.,2026-06-04,Data Governance Lead,D-IH-93-E,v3.1
USE-000003,CAP-HOL-PEOPL-METHOD-ERP-ENGAGEMENT-UX-DESIGN-001,,2024-09-01,PMO,HLK ERP internal operations system (POC-ERP-2024). Dogfooding multi-module ERP with automated deploy verification.,docs/references/hlk/v3.0/Envoy Tech Lab/Repositories/REPOSITORIES_REGISTRY.md,J-OP,,,4,first_realisation,I93 P7 backfill per POC-ERP-2024.,2026-06-04,Data Governance Lead,D-IH-93-E,v3.1
USE-000004,CAP-ENV-TECH-DTP-256,,2025-03-01,System Owner,KiRBe knowledge platform SaaS (POC-KIRBE-2025). First-party productization path; internal use before external paying customer.,docs/references/hlk/v3.0/Envoy Tech Lab/Repositories/REPOSITORIES_REGISTRY.md,J-OP,,,4,first_realisation,I93 P7 backfill per POC-KIRBE-2025.,2026-06-04,Data Governance Lead,D-IH-93-E,v3.1
USE-000005,CAP-ENV-TECH-DTP-295,eng_2026_websitz_shopify,2026-03-16,RevOps Lead,Shopify cart-bundle app for Websitz partner (POC-WEBSITZ-SHOPIFY-2026). Automated test suite and CI multi-job; 6 locales.,docs/references/hlk/v3.0/Admin/O5-1/People/Compliance/canonicals/dimensions/POC_TO_COMMERCIAL_MAP.csv,J-IN;J-CU,,,4,first_realisation,I93 P7; FK GOI-PRT-WEBSITZ-2026; canonical ENG-WEBSITZ-SHOPIFY-2026.,2026-06-04,RevOps Lead,D-IH-93-E,v3.1
USE-000006,CAP-HOL-PEOPL-METHOD-SYNTHESIS-BEFORE-TRANCHE-001,eng_2026_websitz_use_case_2_rushly,2026-04-15,PMO,Rushly SaaS scaffold + governance (POC-RUSHLY-SCAFFOLD-2026). Architecture frozen before code; strict TS monorepo; design-phase engagement.,docs/references/hlk/v3.0/Admin/O5-1/People/Compliance/canonicals/dimensions/POC_TO_COMMERCIAL_MAP.csv,J-OP,,,3,first_realisation,I93 P7; archived engagement eng_2026_websitz_use_case_2_rushly.,2026-06-04,PMO,D-IH-93-E,v3.1
