poc_id,delivery_name,partner_or_buyer_ref,domain,engagement_type,revenue_band,recurring,case_study_status,linked_topic_ids,notes
POC-WEB-2024,Holistica Research site + CRM,internal,marketing+intake,internal_first_delivery,internal,no,operator_review,topic_poc_commercial_map;topic_business_strategy,"Public site (multilingual es/en/fr) + CRM/lead intake. Internal-first delivery: built for Holistica's own canal de adquisición; doubles as the canonical brand-visual source. No external revenue but anchors the moat narrative ('we sell on the same stack we use')."
POC-ERP-2024,HLK ERP internal system,internal,internal_operations,internal_first_delivery,internal,no,nda_only,topic_poc_commercial_map;topic_business_strategy,"Multi-modulo ERP for Holistica's own ops. Tematizacion + verificacion automatica completa antes de cada despliegue. Internal-only product; walkthrough available under NDA. No external revenue but proves dogfooding rigor."
POC-KIRBE-2025,KiRBe knowledge platform (KiRBe SaaS),internal_then_external,product_saas,first_party_product,TODO[OPERATOR-poc-kirbe],yes,public_in_2026,topic_poc_commercial_map;topic_pricing_model;topic_unit_economics,"First-party SaaS. Currently internal use; first paying external customer is a 0-6m milestone (`BOOTSTRAPPING_PLAN.md` §scenario base). Pricing per `PRICING_MODEL.md` §1.2 (3-tier hybrid). The core productization story for the deck."
POC-WEBSITZ-SHOPIFY-2026,Shopify cart-bundle app for Websitz,GOI-PARTNER-WEBSITZ-2026,partner_b2b_shopify,partner_subcontracted,TODO[OPERATOR-poc-websitz],pilot_recurring,closed_engagement,topic_poc_commercial_map;topic_channel_strategy;topic_sales_motion,"Holistica delivered the Shopify carrito-bundle app (admin Polaris + storefront extension); partner Websitz held end-client relationship. ~120 pruebas automaticas + CI multi-job + 6 idiomas. Partner-share per `PRICING_MODEL.md` §1.3. Anchor proof for Channel 2 (partner B2B)."
POC-RUSHLY-SCAFFOLD-2026,Rushly SaaS scaffold + governance,GOI-PARTNER-RUSHLY-2026,partner_b2b_saas,partner_design_phase,TODO[OPERATOR-poc-rushly],pilot,design_phase,topic_poc_commercial_map;topic_channel_strategy;topic_competitive_landscape,"SaaS B2B scaffold for partner Rushly. Arquitectura congelada antes de codificar; monorepo TypeScript estricto; CI multi-job. Demonstrates 'compliance-aware product program' pattern. Currently in design with scaffold productivo; next milestone: implementation phase signed."
