phase,commit_sha,commit_date,change_kind,lines_delta,repo,file_path,file_kind,role_owner,area,entity,decision_ids,process_ids,linked_canonicals,validators_run,requires_operator_gate,change_summary,notes
P0,akos-pending,2026-05-16,created,+650,openclaw-akos,docs/wip/planning/84-substrate-doctrine-and-commercial-readiness/master-roadmap.md,planning,Research Lead,Research,Holistika,D-IH-84-A,,AGENTIC_FRAMEWORK_LANDSCAPE.md;HOLISTIKA_AGENTIC_DOCTRINE.md;PRECEDENCE.md,validate_decision_register,no,I84 master-roadmap charter package per I66/I68 plan-quality bar,Operator review pending; initiative-meta
P0,akos-pending,2026-05-16,created,+170,openclaw-akos,docs/wip/planning/84-substrate-doctrine-and-commercial-readiness/decision-log.md,planning,Research Lead,Research,Holistika,D-IH-84-A;D-IH-84-B;D-IH-84-C;D-IH-84-D;D-IH-84-E;D-IH-84-F;D-IH-84-G;D-IH-84-H,,DECISION_REGISTER.csv,validate_decision_register,no,I84 8-row decision-log preview; DECISION_REGISTER.csv mints operator-pending,initiative-meta
P0,akos-pending,2026-05-16,created,+30,openclaw-akos,docs/wip/planning/84-substrate-doctrine-and-commercial-readiness/risk-register.md,planning,Research Lead,Research,Holistika,D-IH-84-A,,,,no,I84 12-risk register R-IH-84-1 through R-IH-84-12,initiative-meta
P0,akos-pending,2026-05-16,created,+40,openclaw-akos,docs/wip/planning/84-substrate-doctrine-and-commercial-readiness/asset-classification.md,planning,Research Lead,Research,Holistika,D-IH-84-A,,PRECEDENCE.md,,no,I84 asset classification per PRECEDENCE classes,initiative-meta
P0,akos-pending,2026-05-16,created,+50,openclaw-akos,docs/wip/planning/84-substrate-doctrine-and-commercial-readiness/evidence-matrix.md,planning,Research Lead,Research,Holistika,D-IH-84-A,,LOGIC_CHANGE_LOG.md;FOUNDER_METHODOLOGY_VERSIONING.md,,no,I84 per-phase evidence flow + drift baseline,initiative-meta
P0,akos-pending,2026-05-16,created,+10,openclaw-akos,docs/wip/planning/84-substrate-doctrine-and-commercial-readiness/files-modified.csv,planning,Research Lead,Research,Holistika,D-IH-84-A,,,,no,I84 files-modified.csv 18-column header + P0 rows per akos-planning-traceability rule,initiative-meta
P0,akos-pending,2026-05-16,modified,+5,openclaw-akos,docs/wip/planning/README.md,planning,System Owner,Admin,Holistika,D-IH-84-A,,,,no,Add I84 row to planning initiative index table,
P1,9e1000a,2026-05-17,created,+450,openclaw-akos,docs/wip/planning/84-substrate-doctrine-and-commercial-readiness/reports/p1-substrate-landscape-2026-05-17.md,planning,Holistik Researcher,Research,Holistika,D-IH-84-A;D-IH-84-B;D-IH-84-C;D-IH-84-D;D-IH-84-E;D-IH-84-F;D-IH-84-G,,AGENTIC_FRAMEWORK_LANDSCAPE.md;PRECEDENCE.md;confidence_levels.md,validate_hlk,no,I84 P1 substrate landscape audit (17 substrates × 3 classes) per I86 Wave 2 sc-resume §3.5,Operator-readable scope; full Tier-1 WIP deferred to master-roadmap P1; B2 confidence
P2,76a8e12,2026-05-17,created,+370,openclaw-akos,docs/wip/planning/84-substrate-doctrine-and-commercial-readiness/reports/p2-substrate-scorecard-2026-05-17.md,planning,Holistik Researcher,Research,Holistika,D-IH-84-A;D-IH-84-B;D-IH-84-C;D-IH-84-D;D-IH-84-E,,AGENTIC_FRAMEWORK_LANDSCAPE.md;PRECEDENCE.md,validate_hlk,no,I84 P2 substrate scorecard 17×6 grid + 3 scenario analyses + P4 coupling-aware framing,Stops before P3 canonical mint per sc-resume §6 operator-gated fork; surfaces P3 entry inline AskQuestion
post-P2,651fcb6,2026-05-17,created,+110,openclaw-akos,docs/wip/planning/84-substrate-doctrine-and-commercial-readiness/reports/checkpoints/sc-i84-p1p2-complete-2026-05-17.md,planning,Holistik Researcher,Research,Holistika,D-IH-84-A;D-IH-84-B;D-IH-84-C;D-IH-84-D;D-IH-84-E;D-IH-84-F;D-IH-84-G,,,,no,I84 P1+P2 closure agent self-checkpoint per akos-agent-checkpoint-discipline.mdc,Surfaces P3 entry decision + 2 risks (folder-name drift; master-roadmap vs sc-resume P1 scope mismatch)
P1-tier1,e51ed14,2026-05-17,created,+50,openclaw-akos,docs/wip/intelligence/substrate-audit-2026-Q2/README.md,data,Holistik Researcher,Research,Holistika,D-IH-84-A,,,no,Tier-1 WIP folder README per WORKSPACE_BLUEPRINT_HOLISTIKA.md §17,Working-space scope doc; thread index
P1-tier1,e51ed14,2026-05-17,created,+200,openclaw-akos,docs/wip/intelligence/substrate-audit-2026-Q2/competitive-layer-positioning.md,data,Holistik Researcher,Research,Holistika,D-IH-84-A;D-IH-84-D,,competitive-layer-positioning,validate_hlk,no,I84 P1 Layer 1 thread B competitive landscape (Glean / Notion AI / Anthropic Projects / OpenAI Apps SDK / Microsoft Copilot Studio / Google Gemini for Workspace / Composio / Lindy),Option D execution; ~D-IH-84-D shape input
P1-tier1,e51ed14,2026-05-17,created,+220,openclaw-akos,docs/wip/intelligence/substrate-audit-2026-Q2/regulatory-tos-forecast.md,data,Holistik Researcher,Research,Holistika,D-IH-84-A;D-IH-84-B;D-IH-84-D,,regulatory-tos-forecast,validate_hlk,no,I84 P1 Layer 1 thread C regulatory + ToS (EU AI Act 2026 + GDPR-as-SaaS DPA + Cursor MSA + IP-indemnity carve-outs),Option D execution; recommends ADVOPS engagement before D-IH-84-B / D-IH-84-D ratification
P1-tier1,e51ed14,2026-05-17,created,+230,openclaw-akos,docs/wip/intelligence/substrate-audit-2026-Q2/past-poc-translation-matrix.md,data,Holistik Researcher,Research,Holistika,D-IH-84-A;D-IH-84-B;D-IH-84-E,,past-poc-translation-matrix;AGENTIC_FRAMEWORK_LANDSCAPE.md;HOLISTIKA_AGENTIC_DOCTRINE.md,validate_hlk,no,I84 P1 Layer 1 thread D past-PoC translation matrix (I10/I11/I12/I13 + KiRBe-still-on-LlamaIndex + R&L v2.7 framework references),Option D execution; recommends KiRBe narrowing to LlamaIndex-continue + LangGraph-workflow finalists per D-IH-84-E
P3a,666559e,2026-05-17,created,+150,openclaw-akos,docs/references/hlk/v3.0/Admin/O5-1/Research/Methodology/canonicals/SUBSTRATE_LANDSCAPE_DOCTRINE.md,canonical,Holistik Researcher,Research,Holistika,D-IH-84-A;D-IH-84-G,,AGENTIC_FRAMEWORK_LANDSCAPE.md;HOLISTIKA_AGENTIC_DOCTRINE.md;HOLISTIKA_ORGANISING_DOCTRINE.md;PRECEDENCE.md;SOP-RESEARCH_SUBSTRATE_AUDIT_CADENCE_001.md,validate_hlk,yes,I84 P3 Research-area substrate doctrine canonical at status:review per D-IH-84-G,Paired with Tech-Lab AGENTIC_FRAMEWORK_LANDSCAPE.md; promotes to status:active after SOP-META process_list row mint; canonical CSV gate satisfied by status:review posture
P3a,666559e,2026-05-17,created,+220,openclaw-akos,akos/hlk_substrate_registry_csv.py,script,System Owner,Tech,Holistika,D-IH-84-A;D-IH-84-F,,SUBSTRATE_REGISTRY.csv,,no,I84 P3 Pydantic SSOT for SUBSTRATE_REGISTRY (18-column tuple + 8 enum frozensets + SubstrateRegistryRow class) per D-IH-84-F,Per CONTRIBUTING.md Python Code Standards; pairs with akos/hlk_design_pattern_csv.py shape
P3a,666559e,2026-05-17,created,+160,openclaw-akos,scripts/validate_substrate_registry.py,script,System Owner,Tech,Holistika,D-IH-84-A;D-IH-84-F,,SUBSTRATE_REGISTRY.csv,,no,I84 P3 validator for SUBSTRATE_REGISTRY.csv (header drift + Pydantic per-row + uniqueness + frozenset double-check),Not yet wired into release-gate; P3c cascade work; exits 1 against missing CSV (expected pre-P3b)
P3a,666559e,2026-05-17,created,+260,openclaw-akos,tests/test_substrate_registry.py,test,System Owner,Tech,Holistika,D-IH-84-A;D-IH-84-F,,SUBSTRATE_REGISTRY.csv,validate_hlk;pytest,no,I84 P3 tests (24 unit + 4 skipped canonical-CSV-gated integration),Pytest 24 passed 4 skipped 0 failed; integration tests auto-activate when P3b CSV mint lands
P3b,589a902,2026-05-17,created,+19,openclaw-akos,docs/references/hlk/v3.0/Admin/O5-1/People/Compliance/canonicals/dimensions/SUBSTRATE_REGISTRY.csv,canonical,Holistik Researcher,Research,Holistika,D-IH-84-A;D-IH-84-F,,SUBSTRATE_LANDSCAPE_DOCTRINE.md;AGENTIC_FRAMEWORK_LANDSCAPE.md;PRECEDENCE.md,validate_substrate_registry;validate_hlk;pytest,yes,I84 P3b canonical-CSV mint - SUBSTRATE_REGISTRY.csv seeded with 18 rows (8 framework + 7 agent-SDK + 3 architectural-posture) from P1 attribute grid,Operator-approved canonical-CSV gate per inline-ratify 2026-05-17 Option A; Devin + Replit carry akos_integration_state=rejected per audit-trail discipline; status counts active=15 candidate=1 experimental=1 forecasted=1; all 28 tests passing
P3b,589a902,2026-05-17,modified,+2,openclaw-akos,docs/references/hlk/v3.0/Admin/O5-1/People/Compliance/canonicals/PRECEDENCE.md,canonical,System Owner,Admin,Holistika,D-IH-84-A;D-IH-84-F,,SUBSTRATE_REGISTRY.csv;substrate_registry_mirror,validate_hlk,yes,I84 P3b PRECEDENCE.md update - canonical row + mirror row for SUBSTRATE_REGISTRY,Operator-approved canonical-CSV gate; mirror row points to forthcoming Supabase migration (P3c cascade work)
P3b,589a902,2026-05-17,modified,+1,openclaw-akos,docs/wip/planning/84-substrate-doctrine-and-commercial-readiness/reports/p1-substrate-landscape-2026-05-17.md,planning,Holistik Researcher,Research,Holistika,D-IH-84-A,,,,no,Count fix 17->18 substrates (off-by-one in original P1 §2 prose; CSV seed confirmed 18 rows),Editorial correction; underlying audit content unchanged
P3b,589a902,2026-05-17,modified,+2,openclaw-akos,docs/wip/planning/84-substrate-doctrine-and-commercial-readiness/reports/p2-substrate-scorecard-2026-05-17.md,planning,Holistik Researcher,Research,Holistika,D-IH-84-A,,,,no,Count fix 17->18 substrates in §1 + §3 grid title,Editorial correction; underlying scorecard content unchanged
P3c,a77c15d,2026-05-17,created,+115,openclaw-akos,supabase/migrations/20260517000000_i84_substrate_registry_mirror.sql,script,System Owner,Tech,Holistika,D-IH-84-A;D-IH-84-F,,SUBSTRATE_REGISTRY.csv,,yes,I84 P3c Supabase mirror DDL for compliance.substrate_registry_mirror (CHECK constraints on 9 enum cols + 4 indexes + RLS service_role-only),Authored not yet applied; operator runs supabase db push per akos-holistika-operations.mdc §Operator SQL gate Step 4
P3c,a77c15d,2026-05-17,modified,+5,openclaw-akos,scripts/validate_compliance_schema_drift.py,script,System Owner,Tech,Holistika,D-IH-84-A;D-IH-84-F,,SUBSTRATE_REGISTRY.csv,validate_compliance_schema_drift;validate_hlk,no,I84 P3c added SUBSTRATE_REGISTRY row to _REGISTRY tuple - drift validator coverage,Drift validator now confirms 18-column header alignment between CSV and Pydantic SSOT tuple
P3c,a77c15d,2026-05-17,modified,+6,openclaw-akos,scripts/validate_hlk.py,script,System Owner,Tech,Holistika,D-IH-84-A;D-IH-84-F,,SUBSTRATE_REGISTRY.csv,validate_hlk,no,I84 P3c wired validate_substrate_registry into validate_hlk umbrella dispatch,validate_hlk now invokes validate_substrate_registry on every release-gate run
P3c,a77c15d,2026-05-17,modified,+50,openclaw-akos,scripts/sync_compliance_mirrors_from_csv.py,script,System Owner,Tech,Holistika,D-IH-84-A;D-IH-84-F,,SUBSTRATE_REGISTRY.csv;substrate_registry_mirror,validate_hlk,no,I84 P3c sync emit fn + CLI arg + mode_flags + I59 specs/fns/count_keys/count_only print + global emit-everything wiring,Smoke-tested via --substrate-registry-only and --count-only; 5 integration points exercised
P3c,a77c15d,2026-05-17,modified,+1,openclaw-akos,docs/ARCHITECTURE.md,canonical,System Owner,Tech,Holistika,D-IH-84-A;D-IH-84-F,,SUBSTRATE_LANDSCAPE_DOCTRINE.md,,no,I84 P3c HLK Registry orchestration row updated to mention akos/hlk_substrate_registry_csv.py + scripts/validate_substrate_registry.py + cross-link to Research doctrine,Per akos-docs-config-sync.mdc HLK compliance changes trigger
P3c,a77c15d,2026-05-17,modified,+1,openclaw-akos,docs/USER_GUIDE.md,canonical,System Owner,Tech,Holistika,D-IH-84-A;D-IH-84-F,,SUBSTRATE_REGISTRY.csv;SUBSTRATE_LANDSCAPE_DOCTRINE.md,,no,I84 P3c USER_GUIDE §24.1 HLK Operator Model adds Initiative 84 paragraph,Per akos-docs-config-sync.mdc HLK compliance changes trigger
P3c,a77c15d,2026-05-17,modified,+1,openclaw-akos,.cursor/rules/akos-docs-config-sync.mdc,cursor-rule,System Owner,Tech,Holistika,D-IH-84-A;D-IH-84-F,,SUBSTRATE_REGISTRY.csv;substrate_registry_mirror,,no,I84 P3c sync rule row added for akos/hlk_substrate_registry_csv.py,Documents the lock-step contract: edit CSV/Pydantic -> ARCHITECTURE/USER_GUIDE/PRECEDENCE/DOCTRINE/mirror DDL all stay coherent
P3c-supabase-live,b874064,2026-05-17,created,+200,openclaw-akos,docs/wip/planning/84-substrate-doctrine-and-commercial-readiness/reports/p3c-supabase-broader-drift-2026-05-17.md,planning,System Owner,Tech,Holistika,D-IH-84-A,,SUBSTRATE_REGISTRY.csv;substrate_registry_mirror,,no,I84 P3c Supabase broader drift blocker note per Option H1 operator selection contract,Documents 30 pending local + 12 remote-only migrations across 12 prior initiatives for separate operator-coordination session
pre-P4,akos-pending,2026-05-17,created,+220,openclaw-akos,docs/wip/planning/84-substrate-doctrine-and-commercial-readiness/reports/advops-engagement-scoping-2026-05-17.md,planning,Holistik Researcher,Research,Holistika,D-IH-84-A;D-IH-84-B;D-IH-84-D,,ADVISER_ENGAGEMENT_DISCIPLINES.csv;ADVISER_OPEN_QUESTIONS.csv;FOUNDER_FILED_INSTRUMENTS.csv;GOI_POI_REGISTER.csv;regulatory-tos-forecast.md,validate_hlk,no,I84 Wave A1 ADVOPS engagement scoping recommendation (4 disciplines: EU AI Act / GDPR-DPA / IP-IT / jurisdictional fiscal) per R-IH-84-NEW-ADVOPS,Operator-readable scoping; not a binding engagement decision; activation gated to section 4.6 operator-choice
P6,akos-pending,2026-05-17,created,+200,openclaw-akos,docs/references/hlk/v3.0/Admin/O5-1/Research/Methodology/canonicals/SOP-RESEARCH_SUBSTRATE_AUDIT_CADENCE_001.md,sop,Research Lead,Research,Holistika,D-IH-84-A;D-IH-84-G;D-IH-84-H,,SUBSTRATE_LANDSCAPE_DOCTRINE.md;SUBSTRATE_REGISTRY.csv;AGENTIC_FRAMEWORK_LANDSCAPE.md;HOLISTIKA_AGENTIC_DOCTRINE.md;SOP-PEOPLE_CROSS_AREA_BREAKTHROUGH_001.md;SOP-META_PROCESS_MGMT_001.md;WORKSPACE_BLUEPRINT_HOLISTIKA.md,validate_hlk,yes,I84 P6 paired SOP at status:review per D-IH-84-H quarterly cadence + akos-executable-process-catalog Rule 1 SOP+runbook pairing,Promotes to status:active after process_list row env_tech_dtp_substrate_landscape_mtnce_001 mints per SOP-META ordering (operator-pending tranche)
P6,akos-pending,2026-05-17,created,+400,openclaw-akos,scripts/peopl_research_substrate_audit_cadence.py,script,Research Lead,Research,Holistika,D-IH-84-A;D-IH-84-G;D-IH-84-H,,SUBSTRATE_REGISTRY.csv;SOP-RESEARCH_SUBSTRATE_AUDIT_CADENCE_001.md;SUBSTRATE_LANDSCAPE_DOCTRINE.md,,no,I84 P6 paired runbook for SOP-RESEARCH_SUBSTRATE_AUDIT_CADENCE_001 (CLI modes: --staleness-check / --uat-mode / --emit-delta / --list-quarters / default usage),Per CONTRIBUTING.md Python Code Standards: type hints + akos.log.setup_logging + pathlib + stdlib-only; FK-resolves substrate_id citations via SUBSTRATE_REGISTRY_FIELDNAMES tuple as SSOT
P6,akos-pending,2026-05-17,created,+260,openclaw-akos,tests/test_peopl_research_substrate_audit_cadence.py,test,Research Lead,Research,Holistika,D-IH-84-A;D-IH-84-G;D-IH-84-H,,SUBSTRATE_REGISTRY.csv;peopl_research_substrate_audit_cadence.py,pytest,no,I84 P6 unit + integration tests for paired runbook (17 tests: module structure / paired canonicals exist / default mode / staleness-check fresh and stale / uat-mode valid and unresolved and missing / emit-delta valid and missing / list-quarters / helper functions),17 passed in pytest; auto-discovered by tests/ root sweep
P6,akos-pending,2026-05-17,modified,+15,openclaw-akos,config/verification-profiles.json,config,System Owner,Tech,Holistika,D-IH-84-A;D-IH-84-G,,SUBSTRATE_REGISTRY.csv;peopl_research_substrate_audit_cadence.py,,no,I84 P6 substrate_audit_smoke profile (runs --staleness-check + dedicated pytest suite),Per master-roadmap section 3 P6 (f) profile wiring spec
P6,akos-pending,2026-05-17,modified,+2,openclaw-akos,docs/wip/intelligence/README.md,planning,Research Lead,Research,Holistika,D-IH-84-A;D-IH-84-G,,SOP-RESEARCH_SUBSTRATE_AUDIT_CADENCE_001.md,,no,I84 P6 added substrate-audit-YYYY-QN folder convention to Tier-1 WIP README,Convention codified per WORKSPACE_BLUEPRINT_HOLISTIKA section 17
P7,akos-pending,2026-05-17,created,+260,openclaw-akos,docs/wip/intelligence/substrate-audit-2026-Q2/2026-Q2-substrate-audit.md,data,Holistik Researcher,Research,Holistika,D-IH-84-A;D-IH-84-B;D-IH-84-C;D-IH-84-D;D-IH-84-E;D-IH-84-F;D-IH-84-G;D-IH-84-H,,SUBSTRATE_REGISTRY.csv;SOP-RESEARCH_SUBSTRATE_AUDIT_CADENCE_001.md;SUBSTRATE_LANDSCAPE_DOCTRINE.md;AGENTIC_FRAMEWORK_LANDSCAPE.md;HOLISTIKA_AGENTIC_DOCTRINE.md;p1-substrate-landscape-2026-05-17.md;p2-substrate-scorecard-2026-05-17.md;competitive-layer-positioning.md;regulatory-tos-forecast.md;past-poc-translation-matrix.md;advops-engagement-scoping-2026-05-17.md,validate_hlk;peopl_research_substrate_audit_cadence,no,I84 P7 first-quarterly substrate-audit report 2026-Q2 (founding-cycle baseline) - 5-element audit per SOP shape with 2 post-P4 substitution placeholder blocks (sections 6 and 7),All 18 SUBSTRATE_REGISTRY substrate_id citations FK-resolve via runbook --uat-mode; PASS; subsequent cycles delta against this baseline via --emit-delta
P5,akos-pending,2026-05-17,created,+240,openclaw-akos,docs/wip/planning/84-substrate-doctrine-and-commercial-readiness/reports/cross-area-unlock-handoff-2026-05-17.md,planning,System Owner,Tech,Holistika,D-IH-84-A;D-IH-84-B;D-IH-84-C;D-IH-84-D;D-IH-84-E,,i76-madeira-elevation.md;i74-brand-tooling-productization.md;i83-ai-archivist-and-kirbe-ingestor.md;i82-holistika-capability-doctrine-and-commercial-readiness.md;SOP-PEOPLE_CROSS_AREA_BREAKTHROUGH_001.md,validate_hlk,no,I84 Wave B1 P5 cross-area cascade handoff pre-stage (per-candidate cascade summary for I76 / I74 / I83 / I82 with 4 post-P4 substitution placeholder blocks),Per Q3 Option C SHAPE/EXECUTION split - cites SHAPE outcomes but defers EXECUTION decisions to each owning initiative P0; candidate stub edits deferred to parent agent post-P4
P8,akos-pending,2026-05-17,created,+240,openclaw-akos,docs/wip/planning/84-substrate-doctrine-and-commercial-readiness/reports/uat-i84-substrate-doctrine-closure-2026-05-17.md,planning,System Owner,Tech,Holistika,D-IH-84-A;D-IH-84-B;D-IH-84-C;D-IH-84-D;D-IH-84-E;D-IH-84-F;D-IH-84-G;D-IH-84-H;D-IH-84-CLOSURE,,SUBSTRATE_REGISTRY.csv;SUBSTRATE_LANDSCAPE_DOCTRINE.md;SOP-RESEARCH_SUBSTRATE_AUDIT_CADENCE_001.md;p1-substrate-landscape-2026-05-17.md;p2-substrate-scorecard-2026-05-17.md;cross-area-unlock-handoff-2026-05-17.md;advops-engagement-scoping-2026-05-17.md;2026-Q2-substrate-audit.md,validate_hlk,no,I84 Wave B2 P8 closure UAT skeleton with P4 placeholders (20-row results table; 6 pending-P4 + 3 operator-pending closure-batch rows; rest PASS),Per akos-planning-traceability UAT evidence contract; SOC discipline observed (no secrets / keys / prompts); scope-adjustment honestly recorded on row 10 (P3 doctrine canonical substitutes for original Tech-Lab landscape extension framing)
