repo_slug,github_url,class,primary_owner_role,topic_ids,vault_doc_root,api_spec_pointer,api_topic_id,lifecycle_status,notes,consumes_compliance_types,consumes_mirrors,local_path,last_review_at,last_review_by,last_review_decision_id,methodology_version_at_review
kirbe-platform,https://github.com/FraysaXII/kirbe,platform,System Owner,topic_kirbe_billing_plane_routing;topic_holistik_ops_discovery,docs/references/hlk/v3.0/Envoy Tech Lab/KiRBe/,docs/api_reference.md,—,active,KiRBe application repository (operator-confirmed 2026-04-15). v1.2 production: 7 connectors hybrid search audit logging Stripe billing per-tenant usage metering. Tracked by REPO_HEALTH_SNAPSHOT (I32 P7).,yes,SOURCING_REGISTRY;POLICY_REGISTRY,root_cd/kirbe,,,,
openclaw-akos,https://github.com/FraysaXII/openclaw-akos,platform,AI Engineer,topic_madeira_platform;topic_holistik_ops_discovery,docs/references/hlk/v3.0/,docs/references/hlk/v3.0/,—,active,Canonical remote from git remote get-url origin on the AKOS workspace (2026-04-15). I59 P1.1 promotes the markdown index to this CSV-backed dimension.,no,,cd_shadow/openclaw-akos,,,,
akos-telemetry-ci,https://github.com/FraysaXII/openclaw-akos,internal,System Owner,—,—,—,—,active,Same monorepo remote as openclaw-akos; internal class tags Langfuse log-watcher drift automation evidence (no second code tree).,no,,,,,,
hlk-erp,https://github.com/FraysaXII/hlk-erp,platform,System Owner,topic_holistik_ops_discovery,—,—,—,active,Initiative 32 P7 registration (D-IH-32-K). Holistika ERP shell — internal operator UI for process registry organization components sales overview. Stack: Next.js 14 + React + shadcn/ui + Tailwind + Supabase Auth + FastAPI.,yes,PERSONA_REGISTRY;CHANNEL_REGISTRY;SOURCING_REGISTRY;SKILL_REGISTRY;POLICY_REGISTRY;PROGRAM_REGISTRY;TOPIC_REGISTRY;FOUNDER_FILED_INSTRUMENTS;FINOPS_COUNTERPARTY;COMPONENT_SERVICE_MATRIX;baseline_organisation;process_list;DECISION_REGISTER;OPS_REGISTER;INITIATIVE_REGISTRY;CYCLE_REGISTER,root_cd/hlk-erp,,,,
boilerplate,https://github.com/FraysaXII/boilerplate,reference,Brand Manager,topic_brand_visual_identity,—,—,—,reference,Initiative 32 P11 registration (D-IH-32-N). Marketing/web boilerplate. Carries Holistika brand assets. Reference-only per D-IH-32-N: no SSOT obligation no .cursor/rules/ to seed with akos-mirror.mdc; only the EXTERNAL_REPO_CONTRACT.md is shipped (light-touch).,no,,root_cd/boilerplate,,,,
client-delivery-pilot,https://github.com/FraysaXII/client-delivery-pilot,client-delivery,PMO,—,—,—,—,active,Placeholder until an engagement remote is known; no public delivery repo identified in org audit.,no,,,,,,
