phase,commit_sha,commit_date,change_kind,lines_delta,repo,file_path,file_kind,role_owner,area,entity,decision_ids,process_ids,linked_canonicals,validators_run,requires_operator_gate,change_summary,notes
P0,f88d600,2026-05-15,created,+220,openclaw-akos,.cursor/rules/akos-people-discipline-of-disciplines.mdc,cursor-rule,System Owner,Admin,Holistika,D-IH-79-A;D-IH-79-F;D-IH-79-H;D-IH-79-K;D-IH-79-L;D-IH-79-M;D-IH-79-N,,akos-executable-process-catalog.mdc;akos-brand-baseline-reality.mdc;akos-holistika-operations.mdc;akos-inline-ratification.mdc,validate_hlk.py,no,Always-applied Cursor rule codifying People-as-DoD + agentic-as-DoD-recursive + jargon-goes-to-Tech-Lab + KB-stewardship-is-People + anti-jargon discipline + Madeira role-class pattern,initiative-meta
P0,f88d600,2026-05-15,created,+155,openclaw-akos,docs/wip/planning/79-people-manifesto-and-pattern-library/master-roadmap.md,planning,People Operations Lead,People,Holistika,D-IH-79-A;D-IH-79-B;D-IH-79-C;D-IH-79-D;D-IH-79-E;D-IH-79-F;D-IH-79-G;D-IH-79-H;D-IH-79-I;D-IH-79-J;D-IH-79-K;D-IH-79-L;D-IH-79-M;D-IH-79-N,,master-roadmap.md;Cursor plan,validate_hlk.py,no,Workspace mirror of authoritative Cursor plan; phase ordering + dependencies + decisions + sync rule,initiative-meta
P0,f88d600,2026-05-15,created,+200,openclaw-akos,docs/wip/planning/79-people-manifesto-and-pattern-library/decision-log.md,planning,People Operations Lead,People,Holistika,D-IH-79-A;D-IH-79-B;D-IH-79-C;D-IH-79-D;D-IH-79-E;D-IH-79-F;D-IH-79-G;D-IH-79-H;D-IH-79-I;D-IH-79-J;D-IH-79-K;D-IH-79-L;D-IH-79-M;D-IH-79-N,,DECISION_REGISTER.csv,validate_hlk.py,no,Round 1 + Round 3 decisions D-IH-79-A..N with full rationale + decision_source + 8 deferred conundrums C-79-1..8,initiative-meta
P0,f88d600,2026-05-15,created,+50,openclaw-akos,docs/wip/planning/79-people-manifesto-and-pattern-library/risk-register.md,planning,People Operations Lead,People,Holistika,D-IH-79-A;D-IH-79-H;D-IH-79-N,,risk-register.md,validate_hlk.py,no,15 risk rows with mitigation + owner + close-out phase,initiative-meta
P0,f88d600,2026-05-15,created,+15,openclaw-akos,docs/wip/planning/79-people-manifesto-and-pattern-library/files-modified.csv,planning,People Operations Lead,People,Holistika,D-IH-79-A,,files-modified.csv,validate_hlk.py,no,18-col schema seeded with P0 rows,initiative-meta
P0,f88d600,2026-05-15,created,+90,openclaw-akos,docs/wip/planning/79-people-manifesto-and-pattern-library/reports/p0-charter-report.md,planning,People Operations Lead,People,Holistika,D-IH-79-A,,master-roadmap.md;decision-log.md;risk-register.md,validate_hlk.py,no,P0 charter report — 12-row plan-quality bar self-critique gate PASS + decision_source ledger + ratification log,initiative-meta
P0,f88d600,2026-05-15,modified,+12/-2,openclaw-akos,docs/wip/planning/_templates/INITIATIVE_DEPENDENCIES.md,planning,PMO,Admin,Holistika,D-IH-79-A,,INITIATIVE_DEPENDENCIES.md,validate_hlk.py,no,Add I79 node to mermaid diagram + I73 → I79 hard-block edge + I79 row to per-initiative blocker table + history entry,initiative-meta
P0,f88d600,2026-05-15,modified,+3,openclaw-akos,docs/wip/planning/_templates/README.md,planning,PMO,Admin,Holistika,D-IH-79-A,,README.md;PLANNING_COMPENDIUM.md,validate_hlk.py,no,Update I73 row state to closed + add I79 row to per-initiative state table,initiative-meta
P0,f88d600,2026-05-15,modified,+2,openclaw-akos,docs/references/hlk/v3.0/Admin/O5-1/People/Compliance/canonicals/INITIATIVE_REGISTRY.csv,canonical,PMO,People,Holistika,D-IH-79-A,tbi_peopl_dtp_initiative_registry_mtnce_001,INITIATIVE_REGISTRY.csv;PRECEDENCE.md,validate_hlk.py,yes,Append INIT-OPENCLAW_AKOS-79 row (status=active; charter-satisfies-gate; 14 linked decisions),canonical CSV gate
P0,f88d600,2026-05-15,modified,+15,openclaw-akos,docs/references/hlk/v3.0/Admin/O5-1/People/Compliance/canonicals/DECISION_REGISTER.csv,canonical,PMO,People,Holistika,D-IH-79-A;D-IH-79-B;D-IH-79-C;D-IH-79-D;D-IH-79-E;D-IH-79-F;D-IH-79-G;D-IH-79-H;D-IH-79-I;D-IH-79-J;D-IH-79-K;D-IH-79-L;D-IH-79-M;D-IH-79-N,tbi_peopl_dtp_decision_register_mtnce_001,DECISION_REGISTER.csv;decision-log.md,validate_hlk.py,no,Append D-IH-79-A..N (14 rows) with summaries + decision-log path + decision_source notes,initiative-meta
P0,f88d600,2026-05-15,modified,+11,openclaw-akos,docs/references/hlk/v3.0/Admin/O5-1/People/Compliance/canonicals/OPS_REGISTER.csv,canonical,PMO,People,Holistika,D-IH-79-A,tbi_peopl_dtp_ops_register_mtnce_001,OPS_REGISTER.csv,validate_hlk.py,no,Append OPS-79-1..10 (10 rows) one per phase strand including P3a/P3b split,initiative-meta
P0,f88d600,2026-05-15,modified,+1,openclaw-akos,CHANGELOG.md,changelog,PMO,Admin,Holistika,D-IH-79-A;D-IH-79-H,,CHANGELOG.md,validate_hlk.py,no,P0 charter Unreleased entry — Strand A..F + 14 decisions + 10 OPS rows + Cursor rule mint + dep map sync,initiative-meta
P1,c1c4ab6,2026-05-15,created,+220,openclaw-akos,docs/references/hlk/v3.0/Admin/O5-1/People/canonicals/HOLISTIKA_ORGANISING_DOCTRINE.md,canonical,People Operations Lead,People,Holistika,D-IH-79-A;D-IH-79-B;D-IH-79-G;D-IH-79-H;D-IH-79-K,,PEOPLE_AREA_RESTRUCTURE.md;PRECEDENCE.md;ENGAGEMENT_MODEL_REGISTRY.csv;KB_HUMAN_READABILITY_CHARTER.md,validate_hlk.py,yes,Holistika Organising Doctrine (People manifesto) - 10 sections incl operating story verbatim CPO frame; access_level=5 internal-cleared; jargon-free; Madeira role-class footnote; KB-stewardship across every role; agentic-as-DoD-recursive cross-reference,manifest publish gate (operator AL5 review)
P1,c1c4ab6,2026-05-15,modified,+2,openclaw-akos,docs/references/hlk/v3.0/Admin/O5-1/People/Compliance/canonicals/PRECEDENCE.md,canonical,Compliance Officer,People,Holistika,D-IH-79-A;D-IH-79-B,,HOLISTIKA_ORGANISING_DOCTRINE.md,validate_hlk.py,no,Register HOLISTIKA_ORGANISING_DOCTRINE.md as canonical asset (Markdown SSOT) with full description per Initiative 22 forward-layout convention,initiative-meta
P2,5d565e1,2026-05-15,created,+15,openclaw-akos,docs/references/hlk/v3.0/Admin/O5-1/People/Compliance/canonicals/dimensions/PEOPLE_DESIGN_PATTERN_REGISTRY.csv,canonical,Compliance Officer,People,Holistika,D-IH-79-A;D-IH-79-C;D-IH-79-D;D-IH-79-E;D-IH-79-N,tbi_peopl_dtp_design_pattern_registry_mtnce_001,PEOPLE_DESIGN_PATTERN_LIBRARY.md;DECISION_REGISTER.csv;INITIATIVE_REGISTRY.csv;PRECEDENCE.md,validate_design_pattern_registry.py;validate_hlk.py,yes,People Design Pattern Registry CSV - 12-row seed across 10-class taxonomy (register/paired/lifecycle/cross-area/lattice/dual/drift/inline/forward/adapter); FK to DECISION + INITIATIVE; sibling join key for PEOPLE_DESIGN_PATTERN_LIBRARY.md anchors; cross-area inheritance target for process_list 8th col (P6),canonical CSV gate
P2,5d565e1,2026-05-15,created,+181,openclaw-akos,akos/hlk_design_pattern_csv.py,script,System Owner,People,Holistika,D-IH-79-C;D-IH-79-D,,PEOPLE_DESIGN_PATTERN_REGISTRY.csv,validate_hlk.py,no,Pydantic SSOT model DesignPatternRow + DESIGN_PATTERN_FIELDNAMES tuple + 4 Literal enums (10-class pattern_class/5-class discipline_origin/9-class consumer_areas/5-class status); regex on pattern_id slug + DECISION/INITIATIVE FK + Markdown anchor + ISO date,follows CONTRIBUTING.md Python Code Standards
P2,5d565e1,2026-05-15,created,+308,openclaw-akos,scripts/validate_design_pattern_registry.py,script,System Owner,People,Holistika,D-IH-79-N,tbi_peopl_dtp_design_pattern_validator_mtnce_001,PEOPLE_DESIGN_PATTERN_REGISTRY.csv;HOLISTIKA_ORGANISING_DOCTRINE.md;PEOPLE_DESIGN_PATTERN_LIBRARY.md,validate_design_pattern_registry.py,no,Dual-mode validator: registry mode (header drift + Pydantic + FK to DECISION + INITIATIVE + consumer_areas semicolon-token enum) + jargon-scan mode (anti-jargon drift gate over 6 People canonicals; mirrors I66 brand-baseline-reality drift gate shape),paired with akos-people-discipline-of-disciplines.mdc Rule 4
P2,5d565e1,2026-05-15,created,+225,openclaw-akos,tests/test_design_pattern_registry.py,test,System Owner,People,Holistika,D-IH-79-C;D-IH-79-D;D-IH-79-N,,PEOPLE_DESIGN_PATTERN_REGISTRY.csv;DesignPatternRow,validate_hlk.py;pytest,no,17 pytest cases covering CSV header drift + Pydantic per row + 5 enum integrity + 6 invalid-input rejection + dual-mode validator end-to-end,registered under default tests/test_*.py glob
P2,5d565e1,2026-05-15,created,+360,openclaw-akos,docs/references/hlk/v3.0/Admin/O5-1/People/canonicals/PEOPLE_DESIGN_PATTERN_LIBRARY.md,canonical,People Operations Lead,People,Holistika,D-IH-79-A;D-IH-79-C;D-IH-79-D,,PEOPLE_DESIGN_PATTERN_REGISTRY.csv;HOLISTIKA_ORGANISING_DOCTRINE.md;PRECEDENCE.md,validate_design_pattern_registry.py --jargon-scan,no,Human-narrative companion to the design pattern registry CSV; 12 patterns each with 5-section shape (What it is / When to reach for it / What it gives you / How to instantiate it / What it does not do); jargon-free per D-IH-79-N,paired with PEOPLE_DESIGN_PATTERN_REGISTRY.csv via #pattern-<slug> anchors
P2,5d565e1,2026-05-15,created,+115,openclaw-akos,supabase/migrations/20260516000000_i79_compliance_design_pattern_registry_mirror.sql,script,System Owner,People,Holistika,D-IH-79-C;D-IH-79-D,,PEOPLE_DESIGN_PATTERN_REGISTRY.csv,supabase migration list,no,Supabase mirror DDL: compliance.people_design_pattern_registry_mirror table with 6 CHECK constraints (id slug + 4 enums + FK regex + anchor regex) + 5 indexes + RLS deny-by-default + service_role grants + governance.people_design_pattern_registry_view (status=active),paired with --design-pattern-registry-only emit mode in sync_compliance_mirrors_from_csv.py
P2,5d565e1,2026-05-15,modified,+27,openclaw-akos,scripts/sync_compliance_mirrors_from_csv.py,script,System Owner,People,Holistika,D-IH-79-C;D-IH-79-D,,PEOPLE_DESIGN_PATTERN_REGISTRY.csv,validate_hlk.py,no,Add design-pattern-registry-only flag + emit fn + path constant + import + count-only print + full-bundle blocks; 12 INSERT upserts emitted on demand,extends existing factory pattern
P2,5d565e1,2026-05-15,modified,+5,openclaw-akos,scripts/validate_hlk.py,script,System Owner,People,Holistika,D-IH-79-C;D-IH-79-D;D-IH-79-N,,PEOPLE_DESIGN_PATTERN_REGISTRY.csv,validate_hlk.py,no,Wire validate_design_pattern_registry into umbrella dispatcher (registry mode runs as PEOPLE_DESIGN_PATTERN_REGISTRY step),initiative-meta
P2,5d565e1,2026-05-15,modified,+22,openclaw-akos,config/verification-profiles.json,config,System Owner,People,Holistika,D-IH-79-N,,PEOPLE_DESIGN_PATTERN_REGISTRY.csv,validate_hlk.py;verify.py,no,Add people_design_pattern_registry_smoke profile (both registry + jargon-scan modes) + wire jargon-scan into pre_commit profile,operationalises anti-jargon drift gate
P2,5d565e1,2026-05-15,modified,+2,openclaw-akos,docs/references/hlk/v3.0/Admin/O5-1/People/Compliance/canonicals/PRECEDENCE.md,canonical,Compliance Officer,People,Holistika,D-IH-79-A;D-IH-79-C;D-IH-79-D,,PEOPLE_DESIGN_PATTERN_REGISTRY.csv;PEOPLE_DESIGN_PATTERN_LIBRARY.md,validate_hlk.py,no,Register PEOPLE_DESIGN_PATTERN_REGISTRY.csv (canonical CSV) + PEOPLE_DESIGN_PATTERN_LIBRARY.md (canonical Markdown narrative) as canonical assets paired by anchor join key,initiative-meta
P3a,f94f323,2026-05-15,created,+143,openclaw-akos,docs/references/hlk/v3.0/Admin/O5-1/People/canonicals/HOLISTIKA_AGENTIC_DOCTRINE.md,canonical,People Operations Lead,People,Holistika,D-IH-79-A;D-IH-79-F;D-IH-79-G;D-IH-79-L,,HOLISTIKA_ORGANISING_DOCTRINE.md;PEOPLE_DESIGN_PATTERN_LIBRARY.md;SOP-PEOPLE_AGENTIC_OPERATIONS_001.md;ETHICAL_AGENTIC_BOUNDARIES.md;AGENTIC_FRAMEWORK_LANDSCAPE.md;PRECEDENCE.md,validate_hlk.py;validate_design_pattern_registry.py --jargon-scan,no,People-side AI/agentic doctrine — clarity-side anchor of three-part stratified governance split per D-IH-79-F + D-IH-79-L; 8 sections incl agent-in-charge frame + Madeira role-class + cross-references to Tech Lab landscape + Ethics anchor; jargon-free per D-IH-79-N; access_level=5,
P3a,f94f323,2026-05-15,created,+143,openclaw-akos,docs/references/hlk/v3.0/Admin/O5-1/People/canonicals/SOP-PEOPLE_AGENTIC_OPERATIONS_001.md,canonical,People Operations Lead,People,Holistika,D-IH-79-A;D-IH-79-F;D-IH-79-L,tbi_peopl_dtp_agentic_ops_mtnce_001,HOLISTIKA_AGENTIC_DOCTRINE.md;HOLISTIKA_ORGANISING_DOCTRINE.md;ETHICAL_AGENTIC_BOUNDARIES.md;PEOPLE_DESIGN_PATTERN_LIBRARY.md,validate_hlk.py;validate_design_pattern_registry.py --jargon-scan;validate_process_list_pairing.py,no,Paired SOP for People agentic operations cadence — 7 steps (schedule/scope/run/score/verdict/escalation/onboarding); hybrid cadence ratified at I79 P3a inline-ratify gate (monthly baseline + event_triggered on canonical revision); jargon-free; access_level=4,paired with peopl_agentic_knowledge_test.py per akos-executable-process-catalog.mdc Rule 1
P3a,f94f323,2026-05-15,created,+150,openclaw-akos,scripts/peopl_agentic_knowledge_test.py,script,People Operations Lead,People,Holistika,D-IH-79-F;D-IH-79-L,tbi_peopl_dtp_agentic_ops_mtnce_001,SOP-PEOPLE_AGENTIC_OPERATIONS_001.md;HOLISTIKA_AGENTIC_DOCTRINE.md,validate_hlk.py;validate_process_list_pairing.py,no,Paired runbook for the agentic ops SOP — zero-framework Python harness (operator clarity-mandate per D-IH-79-F); interactive + non-interactive modes; KB-bank validation; structured Markdown result file output,follows CONTRIBUTING.md Python Code Standards
P3a,f94f323,2026-05-15,created,+143,openclaw-akos,docs/references/hlk/v3.0/Admin/O5-1/People/Ethics/canonicals/ETHICAL_AGENTIC_BOUNDARIES.md,canonical,Ethics Advisor,People,Holistika,D-IH-79-A;D-IH-79-F;D-IH-79-L,tbi_peopl_dtp_agentic_ethics_boundaries_001,HOLISTIKA_AGENTIC_DOCTRINE.md;HOLISTIKA_ORGANISING_DOCTRINE.md;SOP-PEOPLE_AGENTIC_OPERATIONS_001.md;ETHICAL_AUTOMATION_POSTURE.md;access_levels.md;PRECEDENCE.md,validate_hlk.py;validate_design_pattern_registry.py --jargon-scan,yes,Ethics-side red-lines anchor — 8 forbidden actions; sibling to ETHICAL_AUTOMATION_POSTURE.md (I70 P9); access_level=3 Internal/all role-owners read (ratified at P3a inline-ratify gate per operator framing red lines apply to everyone); hybrid review cadence (annual baseline + event_triggered on red-line crossing); jargon-free,Ethics canonical access level + cadences ratified at inline-ratify gate
P3a,f94f323,2026-05-15,modified,+3,openclaw-akos,docs/references/hlk/v3.0/Admin/O5-1/People/Compliance/canonicals/PRECEDENCE.md,canonical,Compliance Officer,People,Holistika,D-IH-79-A;D-IH-79-F;D-IH-79-L,,HOLISTIKA_AGENTIC_DOCTRINE.md;SOP-PEOPLE_AGENTIC_OPERATIONS_001.md;ETHICAL_AGENTIC_BOUNDARIES.md,validate_hlk.py,no,Register HOLISTIKA_AGENTIC_DOCTRINE.md + SOP-PEOPLE_AGENTIC_OPERATIONS_001.md + ETHICAL_AGENTIC_BOUNDARIES.md as canonical assets (3 new rows),initiative-meta
P3a,f94f323,2026-05-15,modified,+2,openclaw-akos,docs/references/hlk/v3.0/Admin/O5-1/People/Compliance/canonicals/process_list.csv,canonical,People Operations Lead,People,Holistika,D-IH-79-A;D-IH-79-F;D-IH-79-L,tbi_peopl_dtp_agentic_ops_mtnce_001;tbi_peopl_dtp_agentic_ethics_boundaries_001,SOP-PEOPLE_AGENTIC_OPERATIONS_001.md;ETHICAL_AGENTIC_BOUNDARIES.md;peopl_agentic_knowledge_test.py,validate_hlk.py;validate_process_list_pairing.py,yes,Append two new process_list rows for the agentic ops cadence (scheduled monthly) and the ethics red-lines review (gated_operator annual with TODO marker per D-IH-72-W feature-flag pattern),canonical CSV gate
P3a,f94f323,2026-05-15,modified,+1,openclaw-akos,scripts/validate_process_list_pairing.py,script,System Owner,People,Holistika,D-IH-79-F,,peopl_agentic_knowledge_test.py,validate_hlk.py;validate_process_list_pairing.py,no,Add peopl_agentic*.py glob pattern to runbook discovery candidate list,extends existing pattern
P3a,f94f323,2026-05-15,modified,+1,openclaw-akos,CHANGELOG.md,changelog,PMO,Admin,Holistika,D-IH-79-A;D-IH-79-F;D-IH-79-L,,CHANGELOG.md,validate_hlk.py,no,P3a Strand C-People AI doctrine + ops + Ethics anchor entry — 3 canonicals + 1 runbook + 2 process_list rows + 3 PRECEDENCE rows,initiative-meta
P3a,f94f323,2026-05-15,created,+50,openclaw-akos,docs/wip/planning/79-people-manifesto-and-pattern-library/reports/p3a-pause-record-2026-05-15.md,planning,People Operations Lead,People,Holistika,D-IH-79-A;D-IH-79-F;D-IH-79-L,,master-roadmap.md;p0-charter-report.md;PRECEDENCE.md,validate_hlk.py,yes,P3a pause record — Ethics canonical mint + ratification log for AL3/hybrid-cadences + mechanical evidence + numbered approval checklist,Strand C-People closure pause point
